{
  "schema_version": "v1",
  "id": "av_01JBMBTC8W5FQ0RTYAX38P7Z5K",
  "prj_id": "prj_01JBMBTC8W0DVKP3KF5QP56YAR",
  "name": "Aria",
  "template_id": "tpl.base.v1.halfbody",
  "template_version": "1.0.0",
  "status": "draft",
  "created_by": "usr_01JBMBTC8W3YB3JYHG2PRAG1FR",
  "created_at": "2026-04-18T09:00:00Z",
  "tags": ["demo", "foundation", "halfbody_v1"]
}
